{"allowed_predicate_types":["https://mncs.dev/predicate/conformance-result/v0.2"],"distinct_signers":2,"extensions":{},"keys":[{"algorithm":"ed25519","components":["fixture-component"],"contracts":["fixture.contract"],"environments":["sha256:bbbbbbbbbbbbbbbbbbbbbbbbbbbbbbbbbbbbbbbbbbbbbbbbbbbbbbbbbbbbbbbb"],"extensions":{},"keyid":"sha256:34750f98bd59fcfc946da45aaabe933be154a4b5094e1c4abf42866505f3c97e","predicate_types":["https://mncs.dev/predicate/conformance-result/v0.2"],"public_key":"iojj3XQJ8ZX9UtstPLpdcspnCb8dlBIb83SIAbQPb1w=","roles":["evaluator"],"schema_version":"0.2"},{"algorithm":"ed25519","components":["fixture-component"],"contracts":["fixture.contract"],"environments":["sha256:bbbbbbbbbbbbbbbbbbbbbbbbbbbbbbbbbbbbbbbbbbbbbbbbbbbbbbbbbbbbbbbb"],"extensions":{},"keyid":"sha256:6a3803d5f059902a1c6dafbc9ba4729212f7caac08634cc3ae76b27529f03827","predicate_types":["https://mncs.dev/predicate/conformance-result/v0.2"],"public_key":"gTl3Dqh9F19Wo1Rmw0x+zMuNipG07jeiXfYPW4/Js5Q=","roles":["evaluator"],"schema_version":"0.2"}],"minimum_independent_evaluators":2,"minimum_signatures":2,"offline":true,"require_generator_evaluator_separation":false,"required_roles":["evaluator"],"revocations":[],"schema_version":"0.2","trust_domain":"fixture","unknown_handling":"reject"}
